{
  "artifact_type": "exec_plan_bundle",
  "bundle_id": "fixture-bundle-liv-314-legacy",
  "implementation_handoff": {
    "bundle_ref": "runs/run-legacy/outputs/exec_plan_bundle.json",
    "issue_identifier": "LIV-315",
    "issue_url": "https://linear.app/living-systems/issue/LIV-315/implement-fixture-v2-execplan-bundle",
    "workflow_label": "workflow:execplan-implementation"
  },
  "implementation_pack": {
    "bytes": 2167,
    "derived_from_review_doc_sha256": "64288f367d31d10a48decbb7f5b19ec4975e1a3a2991be2a4bc1007d8a61dcf4",
    "ref": "runs/run-legacy/outputs/implementation_pack.json",
    "schema": ".scherzo/workflows/schemas/implementation-pack.v2.schema.json",
    "sha256": "f2686ee19d2f69f494f90597d3c4d2f06d65c8c22ddc4a10bd6379e08d269448"
  },
  "review_doc": {
    "bytes": 1767,
    "path": "test/fixtures/execplan_v2/review-doc.valid.md",
    "sha256": "64288f367d31d10a48decbb7f5b19ec4975e1a3a2991be2a4bc1007d8a61dcf4"
  },
  "review_surface": {
    "branch": "execplan/liv-314",
    "pr_url": "https://github.com/living-systems/scherzo/pull/314",
    "source_bundle_ref": null,
    "status": "published"
  },
  "revision": {
    "number": 1,
    "status": "created",
    "supersedes": null
  },
  "schema_version": 2,
  "source_issue": {
    "identifier": "LIV-314",
    "title": "Fixture v2 ExecPlan bundle",
    "url": "https://linear.app/living-systems/issue/LIV-314/fixture-v2-execplan-bundle"
  },
  "validation": [
    {
      "name": "fixture",
      "status": "passed"
    }
  ],
  "workflow": {
    "run_id": "run-legacy",
    "workflow_fingerprint": "fixture-fingerprint",
    "workflow_id": "execplan"
  }
}
