{
  "artifact_type": "scherzo.exec_plan_bundle.v2",
  "bundle_id": "fixture-bundle-liv-314",
  "entries": [
    {
      "artifact_type": "scherzo.exec_plan.v1",
      "bytes": 1856,
      "kind": "file",
      "media_type": "text/markdown",
      "metadata": {
        "publication": {
          "destination_path": "test/fixtures/execplan_v2/review-doc.valid.md"
        }
      },
      "name": "plan",
      "ref": "runs/run-1/outputs/plan.md",
      "sha256": "6f1b07718f377d21629aca606b39beb2424d6b8503b419b7e65166c003389674"
    },
    {
      "artifact_type": "scherzo.implementation_pack.v2",
      "bytes": 2220,
      "kind": "file",
      "media_type": "application/json",
      "name": "implementation_pack",
      "ref": "runs/run-1/outputs/implementation_pack.json",
      "sha256": "bb23c8a36dc5e9b3d46d8062fd073dc6acf3db208138d2e4b14530d092aa0f40"
    }
  ],
  "implementation_handoff": {
    "bundle_ref": "runs/run-1/outputs/exec_plan_bundle.json",
    "issue_identifier": "LIV-315",
    "issue_url": "https://linear.app/living-systems/issue/LIV-315/implement-fixture-v2-execplan-bundle",
    "workflow_label": "workflow:execplan-implementation"
  },
  "implementation_pack": {
    "bytes": 2220,
    "derived_from_review_doc_sha256": "6f1b07718f377d21629aca606b39beb2424d6b8503b419b7e65166c003389674",
    "ref": "runs/run-1/outputs/implementation_pack.json",
    "schema": ".scherzo/workflows/schemas/implementation-pack.v2.schema.json",
    "sha256": "bb23c8a36dc5e9b3d46d8062fd073dc6acf3db208138d2e4b14530d092aa0f40"
  },
  "kind": "artifact_set",
  "media_type": "application/json",
  "plan": {
    "bytes": 1856,
    "media_type": "text/markdown",
    "ref": "runs/run-1/outputs/plan.md",
    "sha256": "6f1b07718f377d21629aca606b39beb2424d6b8503b419b7e65166c003389674"
  },
  "review_doc": {
    "bytes": 1856,
    "path": "test/fixtures/execplan_v2/review-doc.valid.md",
    "sha256": "6f1b07718f377d21629aca606b39beb2424d6b8503b419b7e65166c003389674"
  },
  "review_surface": {
    "branch": "execplan/liv-314",
    "pr_url": "https://github.com/living-systems/scherzo/pull/314",
    "source_bundle_ref": null,
    "status": "published"
  },
  "revision": {
    "number": 1,
    "status": "created",
    "supersedes": null
  },
  "schema_version": 2,
  "source_issue": {
    "identifier": "LIV-314",
    "title": "Fixture v2 ExecPlan bundle",
    "url": "https://linear.app/living-systems/issue/LIV-314/fixture-v2-execplan-bundle"
  },
  "validation": [
    {
      "name": "fixture",
      "status": "passed"
    }
  ],
  "workflow": {
    "run_id": "run-1",
    "workflow_fingerprint": "fixture-fingerprint",
    "workflow_id": "execplan"
  }
}
