{
  "artifact_type": "scherzo.exec_plan_bundle.v2",
  "bundle_id": "fixture-bundle-liv-314",
  "entries": [
    {
      "artifact_type": "scherzo.exec_plan.v1",
      "bytes": 1767,
      "kind": "file",
      "media_type": "text/markdown",
      "name": "plan",
      "ref": "runs/run-1/outputs/plan.md",
      "sha256": "64288f367d31d10a48decbb7f5b19ec4975e1a3a2991be2a4bc1007d8a61dcf4"
    },
    {
      "artifact_type": "scherzo.implementation_pack.v2",
      "bytes": 2220,
      "kind": "file",
      "media_type": "application/json",
      "name": "implementation_pack",
      "ref": "runs/run-1/outputs/implementation_pack.json",
      "sha256": "0dff7ca136284ffa40da5ae8dd6972de67bf65eb358cef6bf8a39481ff69c201"
    }
  ],
  "implementation_handoff": {
    "bundle_ref": "runs/run-1/outputs/exec_plan_bundle.json",
    "issue_identifier": "LIV-315",
    "issue_url": "https://linear.app/living-systems/issue/LIV-315/implement-fixture-v2-execplan-bundle",
    "workflow_label": "workflow:execplan-implementation"
  },
  "implementation_pack": {
    "bytes": 2220,
    "derived_from_review_doc_sha256": "64288f367d31d10a48decbb7f5b19ec4975e1a3a2991be2a4bc1007d8a61dcf4",
    "ref": "runs/run-1/outputs/implementation_pack.json",
    "schema": ".scherzo/workflows/schemas/implementation-pack.v2.schema.json",
    "sha256": "0dff7ca136284ffa40da5ae8dd6972de67bf65eb358cef6bf8a39481ff69c201"
  },
  "kind": "artifact_set",
  "media_type": "application/json",
  "plan": {
    "bytes": 1767,
    "media_type": "text/markdown",
    "ref": "runs/run-1/outputs/plan.md",
    "sha256": "64288f367d31d10a48decbb7f5b19ec4975e1a3a2991be2a4bc1007d8a61dcf4"
  },
  "review_doc": {
    "bytes": 1767,
    "path": "test/fixtures/execplan_v2/review-doc.valid.md",
    "sha256": "64288f367d31d10a48decbb7f5b19ec4975e1a3a2991be2a4bc1007d8a61dcf4"
  },
  "review_surface": {
    "branch": "execplan/liv-314",
    "pr_url": "https://github.com/living-systems/scherzo/pull/314",
    "source_bundle_ref": null,
    "status": "published"
  },
  "revision": {
    "number": 1,
    "status": "created",
    "supersedes": null
  },
  "schema_version": 2,
  "source_issue": {
    "identifier": "LIV-314",
    "title": "Fixture v2 ExecPlan bundle",
    "url": "https://linear.app/living-systems/issue/LIV-314/fixture-v2-execplan-bundle"
  },
  "validation": [
    {
      "name": "fixture",
      "status": "passed"
    }
  ],
  "workflow": {
    "run_id": "run-1",
    "workflow_fingerprint": "fixture-fingerprint",
    "workflow_id": "execplan"
  }
}
